{"benchmark":{"min_replay_rate":1.0,"trace_count":1},"bundle_id":"KERNEL_MATHLIB03_BIT_INDICES_ODD_REPLAY","created_utc":"2026-06-19T00:00:01Z","invariant_diff":{"case_id":"mathlib03_bit_indices_odd","expected_status":"SUCCESS","kernel_derived":true},"metrics":{"deterministic_replays":1,"infra_flake_count":0,"replay_rate":1.0,"replay_successes":1,"total_replays":1},"schema_id":"QA_MATH_COMPILER_REPLAY_BUNDLE_SCHEMA.v1","toolchain":{"lake_lock_hash":"57861ce4045ac552c23d7559ed62427b3b75fe1ff37bb7d79e2ca81a84642596","lean_version":"4.31.0","toolchain_hash":"5e17bb219eed69eb997ef938d8a902506235d4ebf68075ad5090a7b9f272f434"},"traces":[{"replay_hash":"d7f1c164bc121d35d47655fb7339a6beefd5c8be43f70d31e3ba2a76232ba75e","replay_status":"SUCCESS","result_status":"SUCCESS","seed":0,"trace_hash":"d7f1c164bc121d35d47655fb7339a6beefd5c8be43f70d31e3ba2a76232ba75e","trace_id":"4591b570952656ec6bfb8165e7747bcebda5868338d7967502f2bd187da10a6f"}]}
