{"benchmark":{"min_replay_rate":1.0,"trace_count":1},"bundle_id":"KERNEL_EX43_ADD_RIGHT_CANCEL_REPLAY","created_utc":"2026-06-19T00:00:01Z","invariant_diff":{"case_id":"ex43_add_right_cancel","expected_status":"SUCCESS","kernel_derived":true},"metrics":{"deterministic_replays":1,"infra_flake_count":0,"replay_rate":1.0,"replay_successes":1,"total_replays":1},"schema_id":"QA_MATH_COMPILER_REPLAY_BUNDLE_SCHEMA.v1","toolchain":{"lake_lock_hash":"a247c8d620fdd1a72fb362613c105d5c84ea64a530c477b7a6be87bfc3ccfdfd","lean_version":"4.31.0","toolchain_hash":"73a41f2bfa38cff124a6da9a1f97d62954b5c7df15de9ebb1a8384a60fcde838"},"traces":[{"replay_hash":"98ece6787cf278ea1b869a705c50c8a7cc3060a0ceb83ae2fae10ccb0b582a5e","replay_status":"SUCCESS","result_status":"SUCCESS","seed":0,"trace_hash":"98ece6787cf278ea1b869a705c50c8a7cc3060a0ceb83ae2fae10ccb0b582a5e","trace_id":"c65741340b01a311635317a43920051f96ec74683f3cd899eb8e86bfa6505644"}]}
