{"benchmark":{"min_replay_rate":1.0,"trace_count":1},"bundle_id":"KERNEL_EX49_SUCC_INJECTIVE_REPLAY","created_utc":"2026-06-19T00:00:01Z","invariant_diff":{"case_id":"ex49_succ_injective","expected_status":"SUCCESS","kernel_derived":true},"metrics":{"deterministic_replays":1,"infra_flake_count":0,"replay_rate":1.0,"replay_successes":1,"total_replays":1},"schema_id":"QA_MATH_COMPILER_REPLAY_BUNDLE_SCHEMA.v1","toolchain":{"lake_lock_hash":"e1e50b48c259296d4ac2fdb31b6cc6cb02760cbcf6b161add5fa319b481d82ab","lean_version":"4.31.0","toolchain_hash":"5360f1fd8af0b017bc1d3d50b493881596325886fdce5969d849d6dbb7c69bdb"},"traces":[{"replay_hash":"1d0d679ab10762d89e5dd73c87f87ed47821985c37cc0854c69eb97ee54b6571","replay_status":"SUCCESS","result_status":"SUCCESS","seed":0,"trace_hash":"1d0d679ab10762d89e5dd73c87f87ed47821985c37cc0854c69eb97ee54b6571","trace_id":"426dc22a765ab29a0ac374fdfd9a90a788ce844c0725f012001bac9ad8d5dc3c"}]}
