{"benchmark":{"min_replay_rate":1.0,"trace_count":1},"bundle_id":"KERNEL_MATHLIB30_FINSET_CARD_SINGLETON_REPLAY","created_utc":"2026-06-19T00:00:01Z","invariant_diff":{"case_id":"mathlib30_finset_card_singleton","expected_status":"SUCCESS","kernel_derived":true},"metrics":{"deterministic_replays":1,"infra_flake_count":0,"replay_rate":1.0,"replay_successes":1,"total_replays":1},"schema_id":"QA_MATH_COMPILER_REPLAY_BUNDLE_SCHEMA.v1","toolchain":{"lake_lock_hash":"57861ce4045ac552c23d7559ed62427b3b75fe1ff37bb7d79e2ca81a84642596","lean_version":"4.31.0","toolchain_hash":"5e17bb219eed69eb997ef938d8a902506235d4ebf68075ad5090a7b9f272f434"},"traces":[{"replay_hash":"aa54be30df7ba53c949fafc8a174282880b8bfa5acf798af9500dde3b8128125","replay_status":"SUCCESS","result_status":"SUCCESS","seed":0,"trace_hash":"aa54be30df7ba53c949fafc8a174282880b8bfa5acf798af9500dde3b8128125","trace_id":"5d725b84706be61a7297d7b3b7594e6806963205afdf3d2be43896a6260280ad"}]}
