{
  "benchmark": {
    "min_replay_rate": 1.0,
    "trace_count": 1
  },
  "bundle_id": "KERNEL_QA_ORBIT37_FIB_MAT_ISO_SYMM_GENERATOR_REPLAY",
  "created_utc": "2026-06-22T00:00:00Z",
  "invariant_diff": {
    "case_id": "qa_orbit37_fib_mat_iso_symm_generator",
    "expected_status": "SUCCESS",
    "kernel_derived": true
  },
  "metrics": {
    "deterministic_replays": 1,
    "infra_flake_count": 0,
    "replay_rate": 1.0,
    "replay_successes": 1,
    "total_replays": 1
  },
  "schema_id": "QA_MATH_COMPILER_REPLAY_BUNDLE_SCHEMA.v1",
  "toolchain": {
    "lake_lock_hash": "57861ce4045ac552c23d7559ed62427b3b75fe1ff37bb7d79e2ca81a84642596",
    "lean_version": "4.31.0",
    "toolchain_hash": "e0a7032ab1976a37a3e1e823816b4f490d462c1e864b21e1999c33cdac76e263"
  },
  "traces": [
    {
      "replay_hash": "45091a8177dccadc5085ffa594ae466b78c6fc3244a3152e12e763f8bfcfddfa",
      "replay_status": "SUCCESS",
      "result_status": "SUCCESS",
      "seed": 0,
      "trace_hash": "45091a8177dccadc5085ffa594ae466b78c6fc3244a3152e12e763f8bfcfddfa",
      "trace_id": "b8e103e253138d94102b38211d86c36dd69a64ad54c066366c5cbe576a11e6d9"
    }
  ]
}