{
  "benchmark": {
    "min_replay_rate": 1.0,
    "trace_count": 1
  },
  "bundle_id": "KERNEL_QA_ORBIT25_FIB_MAT_PISANO_9_REPLAY",
  "created_utc": "2026-06-22T00:00:00Z",
  "invariant_diff": {
    "case_id": "qa_orbit25_fib_mat_pisano_9",
    "expected_status": "SUCCESS",
    "kernel_derived": true
  },
  "metrics": {
    "deterministic_replays": 1,
    "infra_flake_count": 0,
    "replay_rate": 1.0,
    "replay_successes": 1,
    "total_replays": 1
  },
  "schema_id": "QA_MATH_COMPILER_REPLAY_BUNDLE_SCHEMA.v1",
  "toolchain": {
    "lake_lock_hash": "57861ce4045ac552c23d7559ed62427b3b75fe1ff37bb7d79e2ca81a84642596",
    "lean_version": "4.31.0",
    "toolchain_hash": "e0a7032ab1976a37a3e1e823816b4f490d462c1e864b21e1999c33cdac76e263"
  },
  "traces": [
    {
      "replay_hash": "cd9c32fe0b4157da54b857c1e807dd870b5a8386cbac44d7a89a88fcdc44eacc",
      "replay_status": "SUCCESS",
      "result_status": "SUCCESS",
      "seed": 0,
      "trace_hash": "cd9c32fe0b4157da54b857c1e807dd870b5a8386cbac44d7a89a88fcdc44eacc",
      "trace_id": "766e8e99b9e9811c5d61f5cbee2ed1415ebed7d8ad2c895d77d28b13abbf2e00"
    }
  ]
}