{"benchmark":{"min_replay_rate":1.0,"trace_count":1},"bundle_id":"KERNEL_EX46_LE_TRANS_REPLAY","created_utc":"2026-06-19T00:00:01Z","invariant_diff":{"case_id":"ex46_le_trans","expected_status":"SUCCESS","kernel_derived":true},"metrics":{"deterministic_replays":1,"infra_flake_count":0,"replay_rate":1.0,"replay_successes":1,"total_replays":1},"schema_id":"QA_MATH_COMPILER_REPLAY_BUNDLE_SCHEMA.v1","toolchain":{"lake_lock_hash":"e1e50b48c259296d4ac2fdb31b6cc6cb02760cbcf6b161add5fa319b481d82ab","lean_version":"4.31.0","toolchain_hash":"5360f1fd8af0b017bc1d3d50b493881596325886fdce5969d849d6dbb7c69bdb"},"traces":[{"replay_hash":"4c4b27d5d4d7a89004f3dece554ed36cc8db352c89f34338f5f998a81662888c","replay_status":"SUCCESS","result_status":"SUCCESS","seed":0,"trace_hash":"4c4b27d5d4d7a89004f3dece554ed36cc8db352c89f34338f5f998a81662888c","trace_id":"1376973929fb6df2e76dd5857deb07607c13613ee857bfeb043378d75bfe2a20"}]}
