{
  "benchmark": {
    "min_replay_rate": 1.0,
    "trace_count": 1
  },
  "bundle_id": "KERNEL_QA_ORBIT39_FIB_MAT_MUL_FIB_VEC_REPLAY",
  "created_utc": "2026-06-22T00:00:00Z",
  "invariant_diff": {
    "case_id": "qa_orbit39_fib_mat_mul_fib_vec",
    "expected_status": "SUCCESS",
    "kernel_derived": true
  },
  "metrics": {
    "deterministic_replays": 1,
    "infra_flake_count": 0,
    "replay_rate": 1.0,
    "replay_successes": 1,
    "total_replays": 1
  },
  "schema_id": "QA_MATH_COMPILER_REPLAY_BUNDLE_SCHEMA.v1",
  "toolchain": {
    "lake_lock_hash": "57861ce4045ac552c23d7559ed62427b3b75fe1ff37bb7d79e2ca81a84642596",
    "lean_version": "4.31.0",
    "toolchain_hash": "e0a7032ab1976a37a3e1e823816b4f490d462c1e864b21e1999c33cdac76e263"
  },
  "traces": [
    {
      "replay_hash": "0ece5748faa2194ef8e254b99b60a639567c48170987518eb8b7148e3204b9d9",
      "replay_status": "SUCCESS",
      "result_status": "SUCCESS",
      "seed": 0,
      "trace_hash": "0ece5748faa2194ef8e254b99b60a639567c48170987518eb8b7148e3204b9d9",
      "trace_id": "a42e455ed04c47735cc727d21f3f2e60c2659b427a180f6b3a1a099a4f58c3d7"
    }
  ]
}