{
  "benchmark": {
    "min_replay_rate": 1.0,
    "trace_count": 1
  },
  "bundle_id": "KERNEL_QA_ORBIT36_FIB_MAT_ISO_ZPOW_REPLAY",
  "created_utc": "2026-06-22T00:00:00Z",
  "invariant_diff": {
    "case_id": "qa_orbit36_fib_mat_iso_zpow",
    "expected_status": "SUCCESS",
    "kernel_derived": true
  },
  "metrics": {
    "deterministic_replays": 1,
    "infra_flake_count": 0,
    "replay_rate": 1.0,
    "replay_successes": 1,
    "total_replays": 1
  },
  "schema_id": "QA_MATH_COMPILER_REPLAY_BUNDLE_SCHEMA.v1",
  "toolchain": {
    "lake_lock_hash": "57861ce4045ac552c23d7559ed62427b3b75fe1ff37bb7d79e2ca81a84642596",
    "lean_version": "4.31.0",
    "toolchain_hash": "e0a7032ab1976a37a3e1e823816b4f490d462c1e864b21e1999c33cdac76e263"
  },
  "traces": [
    {
      "replay_hash": "06da959be587cf5ad24f6121816eee5511ab731ffbb4fca4c63adb2e47ccf8c7",
      "replay_status": "SUCCESS",
      "result_status": "SUCCESS",
      "seed": 0,
      "trace_hash": "06da959be587cf5ad24f6121816eee5511ab731ffbb4fca4c63adb2e47ccf8c7",
      "trace_id": "23621c7ba5add0324738f782fcb46c928f9ec5fb8938ae021252107395be8857"
    }
  ]
}