{"benchmark":{"min_replay_rate":1.0,"trace_count":1},"bundle_id":"KERNEL_EX24_CONST_FUNCTION_REPLAY","created_utc":"2026-06-19T00:00:01Z","invariant_diff":{"case_id":"ex24_const_function","expected_status":"SUCCESS","kernel_derived":true},"metrics":{"deterministic_replays":1,"infra_flake_count":0,"replay_rate":1.0,"replay_successes":1,"total_replays":1},"schema_id":"QA_MATH_COMPILER_REPLAY_BUNDLE_SCHEMA.v1","toolchain":{"lake_lock_hash":"e1e50b48c259296d4ac2fdb31b6cc6cb02760cbcf6b161add5fa319b481d82ab","lean_version":"4.31.0","toolchain_hash":"5360f1fd8af0b017bc1d3d50b493881596325886fdce5969d849d6dbb7c69bdb"},"traces":[{"replay_hash":"a136a0ffe1f5ddf39fe0fa1acc531b3410365ba196004ca1ee7e0ebef0306100","replay_status":"SUCCESS","result_status":"SUCCESS","seed":0,"trace_hash":"a136a0ffe1f5ddf39fe0fa1acc531b3410365ba196004ca1ee7e0ebef0306100","trace_id":"1a23ba600a34852a0761dccb22618d969e3eab0603c804f6109aea724cf9f16c"}]}
