{"benchmark":{"min_replay_rate":1.0,"trace_count":1},"bundle_id":"KERNEL_EX21_EQ_SYMM_REPLAY","created_utc":"2026-06-19T00:00:01Z","invariant_diff":{"case_id":"ex21_eq_symm","expected_status":"SUCCESS","kernel_derived":true},"metrics":{"deterministic_replays":1,"infra_flake_count":0,"replay_rate":1.0,"replay_successes":1,"total_replays":1},"schema_id":"QA_MATH_COMPILER_REPLAY_BUNDLE_SCHEMA.v1","toolchain":{"lake_lock_hash":"e1e50b48c259296d4ac2fdb31b6cc6cb02760cbcf6b161add5fa319b481d82ab","lean_version":"4.31.0","toolchain_hash":"5360f1fd8af0b017bc1d3d50b493881596325886fdce5969d849d6dbb7c69bdb"},"traces":[{"replay_hash":"e4aed8182b9eaee87d418f40683a8d477dc354a9775a883ef7602fadc2066781","replay_status":"SUCCESS","result_status":"SUCCESS","seed":0,"trace_hash":"e4aed8182b9eaee87d418f40683a8d477dc354a9775a883ef7602fadc2066781","trace_id":"1a296e8ccbaa3df9ff443398438689cd43bef754db4a758aab4990b59b4b6d4a"}]}
