{"benchmark":{"min_replay_rate":1.0,"trace_count":1},"bundle_id":"KERNEL_MATHLIB23_LIST_REVERSE_LENGTH_REPLAY","created_utc":"2026-06-19T00:00:01Z","invariant_diff":{"case_id":"mathlib23_list_reverse_length","expected_status":"SUCCESS","kernel_derived":true},"metrics":{"deterministic_replays":1,"infra_flake_count":0,"replay_rate":1.0,"replay_successes":1,"total_replays":1},"schema_id":"QA_MATH_COMPILER_REPLAY_BUNDLE_SCHEMA.v1","toolchain":{"lake_lock_hash":"57861ce4045ac552c23d7559ed62427b3b75fe1ff37bb7d79e2ca81a84642596","lean_version":"4.31.0","toolchain_hash":"5e17bb219eed69eb997ef938d8a902506235d4ebf68075ad5090a7b9f272f434"},"traces":[{"replay_hash":"13abef7a6b22fa8fd43d496418a5591d8fb27791be55b88a010f1bed9c598914","replay_status":"SUCCESS","result_status":"SUCCESS","seed":0,"trace_hash":"13abef7a6b22fa8fd43d496418a5591d8fb27791be55b88a010f1bed9c598914","trace_id":"e3f3954536358b7deaf042d161a13f0f549e8158ed602273aafbe3dbf2b0298b"}]}
