{"benchmark":{"min_replay_rate":1.0,"trace_count":1},"bundle_id":"KERNEL_EX41_LIST_MAP_COMP_REPLAY","created_utc":"2026-06-19T00:00:01Z","invariant_diff":{"case_id":"ex41_list_map_comp","expected_status":"SUCCESS","kernel_derived":true},"metrics":{"deterministic_replays":1,"infra_flake_count":0,"replay_rate":1.0,"replay_successes":1,"total_replays":1},"schema_id":"QA_MATH_COMPILER_REPLAY_BUNDLE_SCHEMA.v1","toolchain":{"lake_lock_hash":"e1e50b48c259296d4ac2fdb31b6cc6cb02760cbcf6b161add5fa319b481d82ab","lean_version":"4.31.0","toolchain_hash":"5360f1fd8af0b017bc1d3d50b493881596325886fdce5969d849d6dbb7c69bdb"},"traces":[{"replay_hash":"da54aba4d8c2bdced783304e7b8a5eeb50bf3561d828c197624dea532d357aeb","replay_status":"SUCCESS","result_status":"SUCCESS","seed":0,"trace_hash":"da54aba4d8c2bdced783304e7b8a5eeb50bf3561d828c197624dea532d357aeb","trace_id":"739f3dae10deaf12f6cb2c9b5e4e82f16148ef9722729082b55bbe6a931d453b"}]}
