{"benchmark":{"min_replay_rate":1.0,"trace_count":1},"bundle_id":"KERNEL_MATHLIB15_FINSET_CARD_UNION_LE_REPLAY","created_utc":"2026-06-19T00:00:01Z","invariant_diff":{"case_id":"mathlib15_finset_card_union_le","expected_status":"SUCCESS","kernel_derived":true},"metrics":{"deterministic_replays":1,"infra_flake_count":0,"replay_rate":1.0,"replay_successes":1,"total_replays":1},"schema_id":"QA_MATH_COMPILER_REPLAY_BUNDLE_SCHEMA.v1","toolchain":{"lake_lock_hash":"57861ce4045ac552c23d7559ed62427b3b75fe1ff37bb7d79e2ca81a84642596","lean_version":"4.31.0","toolchain_hash":"5e17bb219eed69eb997ef938d8a902506235d4ebf68075ad5090a7b9f272f434"},"traces":[{"replay_hash":"268c7e4f078eef57a47913e8c30fcc90ffc48aa20732057cd12522159dc34730","replay_status":"SUCCESS","result_status":"SUCCESS","seed":0,"trace_hash":"268c7e4f078eef57a47913e8c30fcc90ffc48aa20732057cd12522159dc34730","trace_id":"8e212c63f42fe25e15eac0aeedb62761a83dc286fccf2417bdf26d9044782554"}]}
