{"benchmark":{"min_replay_rate":1.0,"trace_count":1},"bundle_id":"KERNEL_MATHLIB29_FINSET_CARD_RANGE_REPLAY","created_utc":"2026-06-19T00:00:01Z","invariant_diff":{"case_id":"mathlib29_finset_card_range","expected_status":"SUCCESS","kernel_derived":true},"metrics":{"deterministic_replays":1,"infra_flake_count":0,"replay_rate":1.0,"replay_successes":1,"total_replays":1},"schema_id":"QA_MATH_COMPILER_REPLAY_BUNDLE_SCHEMA.v1","toolchain":{"lake_lock_hash":"57861ce4045ac552c23d7559ed62427b3b75fe1ff37bb7d79e2ca81a84642596","lean_version":"4.31.0","toolchain_hash":"5e17bb219eed69eb997ef938d8a902506235d4ebf68075ad5090a7b9f272f434"},"traces":[{"replay_hash":"79718e6dd08bb503896a28eaee75b4ff2aa88f8b67e783110e864c98cdc406ed","replay_status":"SUCCESS","result_status":"SUCCESS","seed":0,"trace_hash":"79718e6dd08bb503896a28eaee75b4ff2aa88f8b67e783110e864c98cdc406ed","trace_id":"1dfc6caf3da46f9831e8edc97abb7ecac55d33905409d6cc8dadbee96bdbb277"}]}
