{"benchmark":{"min_replay_rate":1.0,"trace_count":1},"bundle_id":"KERNEL_MATHLIB22_LIST_MAP_LENGTH_REPLAY","created_utc":"2026-06-19T00:00:01Z","invariant_diff":{"case_id":"mathlib22_list_map_length","expected_status":"SUCCESS","kernel_derived":true},"metrics":{"deterministic_replays":1,"infra_flake_count":0,"replay_rate":1.0,"replay_successes":1,"total_replays":1},"schema_id":"QA_MATH_COMPILER_REPLAY_BUNDLE_SCHEMA.v1","toolchain":{"lake_lock_hash":"57861ce4045ac552c23d7559ed62427b3b75fe1ff37bb7d79e2ca81a84642596","lean_version":"4.31.0","toolchain_hash":"5e17bb219eed69eb997ef938d8a902506235d4ebf68075ad5090a7b9f272f434"},"traces":[{"replay_hash":"f1044d078e5cec40564048d7aacca6fbd65cc566f36f2df21d5a8b97ed0132ee","replay_status":"SUCCESS","result_status":"SUCCESS","seed":0,"trace_hash":"f1044d078e5cec40564048d7aacca6fbd65cc566f36f2df21d5a8b97ed0132ee","trace_id":"db8bc8ce5bdc5047cdb8287c4a07072cb3d38bf43c732892321301e160434c2b"}]}
