{"benchmark":{"min_replay_rate":1.0,"trace_count":1},"bundle_id":"KERNEL_EX45_ONE_MUL_REPLAY","created_utc":"2026-06-19T00:00:01Z","invariant_diff":{"case_id":"ex45_one_mul","expected_status":"SUCCESS","kernel_derived":true},"metrics":{"deterministic_replays":1,"infra_flake_count":0,"replay_rate":1.0,"replay_successes":1,"total_replays":1},"schema_id":"QA_MATH_COMPILER_REPLAY_BUNDLE_SCHEMA.v1","toolchain":{"lake_lock_hash":"e1e50b48c259296d4ac2fdb31b6cc6cb02760cbcf6b161add5fa319b481d82ab","lean_version":"4.31.0","toolchain_hash":"5360f1fd8af0b017bc1d3d50b493881596325886fdce5969d849d6dbb7c69bdb"},"traces":[{"replay_hash":"6c0805c44e29888aac425562d0661fb60989fe390a8cd980978b496e865a0390","replay_status":"SUCCESS","result_status":"SUCCESS","seed":0,"trace_hash":"6c0805c44e29888aac425562d0661fb60989fe390a8cd980978b496e865a0390","trace_id":"948b3a76af130349a21ff252a6b30404c02d5a06edd9a29e2e063d3226a600a1"}]}
