{"benchmark":{"min_replay_rate":1.0,"trace_count":1},"bundle_id":"KERNEL_MATHLIB21_LIST_LENGTH_APPEND_REPLAY","created_utc":"2026-06-19T00:00:01Z","invariant_diff":{"case_id":"mathlib21_list_length_append","expected_status":"SUCCESS","kernel_derived":true},"metrics":{"deterministic_replays":1,"infra_flake_count":0,"replay_rate":1.0,"replay_successes":1,"total_replays":1},"schema_id":"QA_MATH_COMPILER_REPLAY_BUNDLE_SCHEMA.v1","toolchain":{"lake_lock_hash":"57861ce4045ac552c23d7559ed62427b3b75fe1ff37bb7d79e2ca81a84642596","lean_version":"4.31.0","toolchain_hash":"5e17bb219eed69eb997ef938d8a902506235d4ebf68075ad5090a7b9f272f434"},"traces":[{"replay_hash":"15df4936ea27459cbf71eef688a35f6f4d5e1dcfba0f641582af108a0fecb073","replay_status":"SUCCESS","result_status":"SUCCESS","seed":0,"trace_hash":"15df4936ea27459cbf71eef688a35f6f4d5e1dcfba0f641582af108a0fecb073","trace_id":"292ed94db01787558674b18d35a17b1e80b5e9d0a4d5d9d82cb5b8e42c4da061"}]}
