{"benchmark":{"min_replay_rate":1.0,"trace_count":1},"bundle_id":"KERNEL_EX02_MUL_ADD_DISTRIB_REPLAY","created_utc":"2026-06-19T00:00:01Z","invariant_diff":{"case_id":"ex02_mul_add_distrib","expected_status":"SUCCESS","kernel_derived":true},"metrics":{"deterministic_replays":1,"infra_flake_count":0,"replay_rate":1.0,"replay_successes":1,"total_replays":1},"schema_id":"QA_MATH_COMPILER_REPLAY_BUNDLE_SCHEMA.v1","toolchain":{"lake_lock_hash":"e1e50b48c259296d4ac2fdb31b6cc6cb02760cbcf6b161add5fa319b481d82ab","lean_version":"4.31.0","toolchain_hash":"5360f1fd8af0b017bc1d3d50b493881596325886fdce5969d849d6dbb7c69bdb"},"traces":[{"replay_hash":"ac3669703b29062dbf2569492e89235a3a1ed6ad8e23f357379c8f88ac3f27bd","replay_status":"SUCCESS","result_status":"SUCCESS","seed":0,"trace_hash":"ac3669703b29062dbf2569492e89235a3a1ed6ad8e23f357379c8f88ac3f27bd","trace_id":"26189f8dfe0d76c6e9beff91b5345ae69073b29c3d3eb56377ff08a23fa80b07"}]}
